{
  "schemaVersion": 1,
  "unitId": "vanilla-aq20-ayamiss",
  "ruleset": "vanilla",
  "boss": "Ayamiss the Hunter",
  "raid": "Ruins of Ahn'Qiraj",
  "mapId": 509,
  "encounterId": null,
  "rawEncounterId": 722,
  "providerMapping": {
    "status": "unresolved",
    "basis": "No qualified retained boss identity; addon declarations and client candidates are not provider IDs."
  },
  "bossUnits": [
    "vanilla-aq20-ayamiss"
  ],
  "researchEvidence": {
    "retainedCombatEventsAvailable": false,
    "scope": "Baseline source/client research only; no confirmed retained pull. Synthetic probes grant no observed, native or visual credit."
  },
  "verification": "unverified",
  "sources": [
    {
      "id": "dbm",
      "url": "https://raw.githubusercontent.com/DeadlyBossMods/DBM-Vanilla/973df0cc511f0ef67bc6bb5576e3d55743e31ffa/DBM-Raids-Vanilla/AQ20/Ayamiss.lua",
      "quality": "pinned primary addon; Vanilla branch only, prediction timers not server events",
      "revision": "973df0cc511f0ef67bc6bb5576e3d55743e31ffa"
    },
    {
      "id": "guide",
      "url": "https://www.wowhead.com/classic/guide/ayamiss-the-hunter-ruins-of-ahnqiraj-strategy",
      "quality": "authored baseline Classic strategy; not source of observed coverage or native pixels"
    },
    {
      "id": "bigwigs",
      "url": "https://raw.githubusercontent.com/BigWigsMods/BigWigs_Classic/2cc8e655144c096c6c0a070ecb0a1dd9157f81ef/AQ20/Ayamiss.lua",
      "quality": "pinned primary addon baseline branch"
    },
    {
      "id": "official",
      "url": "https://worldofwarcraft.blizzard.com/en-us/news/23493335",
      "quality": "official 2020 baseline overview retrieved via search index; direct 403, optional Moam/Buru/Ayamiss differ from SoD all-six rule"
    },
    {
      "id": "client",
      "quality": "current production converter graph, not historical Vanilla client/pixel proof",
      "kind": "client-reference",
      "availability": "Referenced by the research. Local evidence and assets are omitted from this library."
    }
  ],
  "expectedMechanics": [
    {
      "id": "C01",
      "mechanic": "Airborne and landing",
      "spellIds": [],
      "clientCandidateSpellIds": [],
      "trigger": "Official starts airborne; Primary addon 70 percent phase with 75 percent prewarning",
      "state": "Airborne and landing",
      "lifecycle": "Actual flight interval/landing, not instant health-based Z switch",
      "placement": "Real altitude, landing path and facing",
      "animation": "Native fly/land sequences when evidenced",
      "acceptanceCheck": "vanilla-aq20-ayamiss/AYAMISS-FLIGHT",
      "acceptanceCriteria": "AYAMISS-FLIGHT: no floor clamp or global height offset",
      "sourceRefs": [
        "dbm",
        "guide",
        "bigwigs",
        "client"
      ],
      "verification": "unverified",
      "spellIdEvidence": {
        "mappingStatus": "No associated spell identity established; do not invent one."
      }
    },
    {
      "id": "C02",
      "mechanic": "Stingers",
      "spellIds": [
        25748,
        25749
      ],
      "clientCandidateSpellIds": [],
      "trigger": "Unresolved for Vanilla: the air-phase poison stacking and raid-spray attribution came from a SoD account and does not establish baseline behavior.",
      "state": "Stingers",
      "lifecycle": "Actual cast/hits/stack removal; no 30s spray generator",
      "placement": "Unresolved Vanilla target selection and relation to flight; no high-threat recipient or spray targets are inferred.",
      "animation": "Native 2370/222018 casts and impact 222019",
      "acceptanceCheck": "vanilla-aq20-ayamiss/AYAMISS-STING",
      "acceptanceCriteria": "AYAMISS-STING: establish Vanilla trigger, recipients and flight relation before accepting behavior",
      "sourceRefs": [
        "dbm",
        "guide",
        "bigwigs",
        "client"
      ],
      "verification": "unverified",
      "spellIdEvidence": {
        "mappingStatus": "Research-associated identities; occurrence and native behavior remain independently unverified."
      }
    },
    {
      "id": "C03",
      "mechanic": "Paralyze and altar",
      "spellIds": [
        25725
      ],
      "clientCandidateSpellIds": [],
      "trigger": "Primary addons player Paralyze",
      "state": "Paralyze and altar",
      "lifecycle": "Actual 10s or early removal; teleport/immobilization independent",
      "placement": "Observed altar anchor/Z and movement discontinuity",
      "animation": "Native target 6441/222024 and actual restraint",
      "acceptanceCheck": "vanilla-aq20-ayamiss/AYAMISS-ALTAR",
      "acceptanceCriteria": "AYAMISS-ALTAR: no interpolated teleport or generated marker",
      "sourceRefs": [
        "dbm",
        "guide",
        "bigwigs",
        "client"
      ],
      "verification": "unverified",
      "spellIdEvidence": {
        "mappingStatus": "Research-associated identities; occurrence and native behavior remain independently unverified."
      }
    },
    {
      "id": "C04",
      "mechanic": "Larva pursuit and feeding",
      "spellIds": [
        25724,
        25721,
        25726
      ],
      "clientCandidateSpellIds": [],
      "trigger": "Baseline larva approaches immobilized victim",
      "state": "Larva pursuit and feeding",
      "lifecycle": "Actual birth/contact/feed/target death or successful larva kill",
      "placement": "Real larva path and actual destination",
      "animation": "Native larva and feed effect",
      "acceptanceCheck": "vanilla-aq20-ayamiss/AYAMISS-LARVA",
      "acceptanceCriteria": "AYAMISS-LARVA: no distance-only scripted death/add",
      "sourceRefs": [
        "dbm",
        "guide",
        "bigwigs",
        "client"
      ],
      "verification": "unverified",
      "spellIdEvidence": {
        "mappingStatus": "Research-associated identities; occurrence and native behavior remain independently unverified."
      }
    },
    {
      "id": "C05",
      "mechanic": "Swarmers",
      "spellIds": [
        25708,
        25709,
        25711
      ],
      "clientCandidateSpellIds": [],
      "trigger": "Baseline airborne swarm descends",
      "state": "Swarmers",
      "lifecycle": "Actual independent spawn/teleport/start/death; no assumed 20 actors",
      "placement": "Observed aerial and ground paths",
      "animation": "Native swarmer actors",
      "acceptanceCheck": "vanilla-aq20-ayamiss/AYAMISS-SWARM",
      "acceptanceCriteria": "AYAMISS-SWARM: each lifetime and height evidenced",
      "sourceRefs": [
        "dbm",
        "guide",
        "bigwigs",
        "client"
      ],
      "verification": "unverified",
      "spellIdEvidence": {
        "mappingStatus": "Research-associated identities; occurrence and native behavior remain independently unverified."
      }
    },
    {
      "id": "C06",
      "mechanic": "Enrage and disease cloud",
      "spellIds": [
        8269,
        17742
      ],
      "clientCandidateSpellIds": [],
      "trigger": "BigWigs aura/cloud damage handling",
      "state": "Enrage and disease cloud",
      "lifecycle": "Actual enrage removal and area membership/expiry",
      "placement": "Boss aura versus independent cloud",
      "animation": "Native actual enrage and disease cloud",
      "acceptanceCheck": "vanilla-aq20-ayamiss/AYAMISS-CLOUD",
      "acceptanceCriteria": "AYAMISS-CLOUD: no source/ground conflation",
      "sourceRefs": [
        "dbm",
        "guide",
        "bigwigs",
        "client"
      ],
      "verification": "unverified",
      "spellIdEvidence": {
        "mappingStatus": "Research-associated identities; occurrence and native behavior remain independently unverified."
      }
    },
    {
      "id": "C07",
      "mechanic": "Death and reset",
      "spellIds": [],
      "clientCandidateSpellIds": [],
      "trigger": "Actual boss death/wipe and independent actor cleanup",
      "state": "Boss, adds and control remain separate",
      "lifecycle": "Only actual lifetime/removal edges; no checkpoint, inherited curse or automatic add retirement",
      "placement": "Actual spawn/return anchors and surviving actor positions",
      "animation": "Native death/reset/object state only when established",
      "acceptanceCheck": "vanilla-aq20-ayamiss/VANILLA-AYAMISS-RESET",
      "acceptanceCriteria": "VANILLA-AYAMISS-RESET: repeated pull, surviving adds and exact cleanup without synthesized actors",
      "sourceRefs": [
        "dbm",
        "guide",
        "bigwigs",
        "client"
      ],
      "verification": "unverified",
      "spellIdEvidence": {
        "mappingStatus": "No associated spell identity established; do not invent one."
      }
    }
  ],
  "clientCandidateSpellIds": [],
  "candidateLimit": "Client candidates are separate from observed usage and do not authorize aliases, schedules or coordinates.",
  "unresolved": [
    "Retained cache completeness unknown unless a coverage receipt is established.",
    "No source-only schedule, ID alias, height, actor birth or world destination is generated.",
    "No Era/SoM/Hardcore subtype is guessed from realmSeasonID 2.",
    "Current source consumers and cached CPU outcomes are separate from a certified complete report and historical visual fidelity.",
    "Vanilla air-phase poison stacking, raid-spray behavior and target selection remain unsupported by the cited SoD account; no substitute baseline behavior is asserted."
  ],
  "researchContext": {
    "npcIds": [
      15369,
      15546,
      15555
    ]
  }
}
