{
  "schemaVersion": 1,
  "unitId": "vanilla-aq40-skeram",
  "ruleset": "vanilla",
  "boss": "The Prophet Skeram",
  "raid": "Temple of Ahn'Qiraj",
  "mapId": 531,
  "encounterId": 50709,
  "rawEncounterId": 709,
  "providerMapping": {
    "status": "mapped-from-retained-report",
    "basis": "Direct qualified baseline report identity; raw and provider identities kept separate."
  },
  "bossUnits": [
    "vanilla-aq40-skeram"
  ],
  "researchEvidence": {
    "retainedCombatEventsAvailable": true,
    "scope": "Retained baseline events were audited; cached event completeness is unknown. Public metadata qualifies the baseline ruleset; exact realm subtype is not inferred. No native/visual acceptance transfers."
  },
  "verification": "unverified",
  "sources": [
    {
      "id": "addon",
      "url": "https://github.com/DeadlyBossMods/DBM-Vanilla/blob/973df0cc511f0ef67bc6bb5576e3d55743e31ffa/DBM-Raids-Vanilla/AQ40/Skeram.lua",
      "quality": "Pinned primary addon; use baseline registrations, exclude explicit seasonal branches; bars are advisory"
    },
    {
      "id": "guide",
      "url": "https://www.wowhead.com/classic/guide/the-prophet-skeram-temple-of-ahnqiraj-strategy",
      "quality": "Retrieved Classic baseline guide; expected mechanics, not original-game pixel proof"
    },
    {
      "id": "cache",
      "quality": "Live-qualified Vanilla identity; cached completeness unverified",
      "kind": "retained-evidence",
      "availability": "Referenced by the research. Local evidence and assets are omitted from this library."
    }
  ],
  "expectedMechanics": [
    {
      "id": "M01",
      "mechanic": "Quartile images",
      "spellIds": [
        747
      ],
      "clientCandidateSpellIds": [],
      "trigger": "Actual summon/image identity at source75/50/25percent expectations",
      "state": "True boss and two independently active images per split",
      "lifecycle": "Actual spawn/death/owner completion; no HP-triggered synthetic copies",
      "placement": "Recorded platform anchors, no cloned coordinate layout",
      "animation": "Same-looking actor identity does not prescribe opacity/scale/display substitution",
      "acceptanceCheck": "vanilla-aq40-skeram/V-AQ-SKERAM-IMAGES",
      "acceptanceCriteria": "V-AQ-SKERAM-IMAGES: each recorded instance bounded independently; boss death closes only sourced images",
      "sourceRefs": [
        "addon",
        "guide"
      ],
      "verification": "unverified",
      "spellIdEvidence": {
        "mappingStatus": "Research-associated identities; occurrence and native behavior remain independently unverified."
      }
    },
    {
      "id": "M02",
      "mechanic": "Teleport",
      "spellIds": [
        20449,
        8195,
        4801
      ],
      "clientCandidateSpellIds": [],
      "trigger": "Recorded source cast and subsequent anchors",
      "state": "Discontinuous source movement and separate threat state",
      "lifecycle": "Exact event boundary, no random timer schedule",
      "placement": "Next observed anchor is estimated landing; no walking route or inferred height",
      "animation": "Authored departure/arrival separate from body movement",
      "acceptanceCheck": "vanilla-aq40-skeram/V-AQ-SKERAM-TELE",
      "acceptanceCriteria": "V-AQ-SKERAM-TELE: before/exact/after recorded casts, including below cutoff, preserve source and image identities",
      "sourceRefs": [
        "addon",
        "guide"
      ],
      "verification": "unverified",
      "spellIdEvidence": {
        "mappingStatus": "Research-associated identities; occurrence and native behavior remain independently unverified."
      }
    },
    {
      "id": "M03",
      "mechanic": "True Fulfillment",
      "spellIds": [
        785
      ],
      "clientCandidateSpellIds": [],
      "trigger": "Actual controlled recipient aura",
      "state": "Control, empowered body and allegiance separate",
      "lifecycle": "Actual removal ends control; source20second guide is not timer",
      "placement": "Actual recipient, logged markers separate from addon4–8",
      "animation": "Inspect actual authored body procedure before any scale change",
      "acceptanceCheck": "vanilla-aq40-skeram/V-AQ-SKERAM-MC",
      "acceptanceCriteria": "V-AQ-SKERAM-MC: correct controller/recipient and seek; do not fabricate action/cast-source remapping",
      "sourceRefs": [
        "addon",
        "guide"
      ],
      "verification": "unverified",
      "spellIdEvidence": {
        "mappingStatus": "Research-associated identities; occurrence and native behavior remain independently unverified."
      }
    },
    {
      "id": "M04",
      "mechanic": "Arcane Explosion and Earth Shock",
      "spellIds": [
        26192
      ],
      "clientCandidateSpellIds": [],
      "trigger": "Actual cast, interrupts and actual Earth Shock results",
      "state": "Source-owned casts and collateral victims independent",
      "lifecycle": "Explicit interrupt/death/result; no melee-count or no-tank script simulation",
      "placement": "Recorded facing/anchors and true victims",
      "animation": "Exact spell IDs and native cast/result kit",
      "acceptanceCheck": "vanilla-aq40-skeram/V-AQ-SKERAM-CAST",
      "acceptanceCriteria": "V-AQ-SKERAM-CAST: source-instance interrupt cancels exact spell; collateral results bind concurrent cast",
      "sourceRefs": [
        "addon",
        "guide"
      ],
      "verification": "unverified",
      "spellIdEvidence": {
        "mappingStatus": "Research-associated identities; occurrence and native behavior remain independently unverified."
      }
    },
    {
      "id": "M05",
      "mechanic": "Death, wipe and continuation",
      "spellIds": [],
      "clientCandidateSpellIds": [],
      "trigger": "Actual life, completion and continuation evidence",
      "state": "Living, defeated, dead, absent and reset remain distinct",
      "lifecycle": "Close only proven encounter-owned state; retain observed target continuations and raw outcome contradictions",
      "placement": "Observed actor-instance anchors; missing Z stays unknown",
      "animation": "Death and despawn are separate; no fixed reset animation",
      "acceptanceCheck": "vanilla-aq40-skeram/V-AQ-SKERAM-END",
      "acceptanceCriteria": "V-AQ-SKERAM-END: seek across boundaries preserves life/ownership; no lastSeen expiry or kill-to-death shortcut",
      "sourceRefs": [
        "addon",
        "guide"
      ],
      "verification": "unverified",
      "spellIdEvidence": {
        "mappingStatus": "No associated spell identity established; do not invent one."
      }
    }
  ],
  "clientCandidateSpellIds": [],
  "candidateLimit": "Client candidates are separate from observed usage and do not authorize aliases, schedules or coordinates.",
  "unresolved": [
    "Exact teleport during split, image appearance/withdrawal server timestamps, control body size and marker onset are not accepted.",
    "Final control aura lacks removal in retained candidate span; do not force-remove it from boss death alone.",
    "Cached coverage is unverified; absence is not proof that a mechanic did not occur.",
    "Realm seasonID6 retained without assigning Hardcore/Fresh subtype.",
    "No native/GPU/browser or actual-game visual acceptance. Missing Z is unknown."
  ],
  "researchContext": {
    "npcIds": [
      15263
    ],
    "baselineScope": "Baseline quartile splits and platform teleports; no SoD Descent Into Madness, Curse of Despair or image-swap conditions imported. Arcane Explosion26192, control785 and teleport20449/8195/4801 are primary-addon IDs; Earth Shock ID awaits direct verification."
  }
}
