{
  "schemaVersion": 1,
  "unitId": "vanilla-mc-garr",
  "ruleset": "vanilla",
  "boss": "Garr",
  "raid": "Molten Core",
  "mapId": 409,
  "encounterId": 50666,
  "rawEncounterId": 666,
  "providerMapping": {
    "status": "mapped-from-retained-report",
    "basis": "Direct qualified baseline report identity; raw and provider identities kept separate."
  },
  "bossUnits": [
    "vanilla-mc-garr"
  ],
  "researchEvidence": {
    "retainedCombatEventsAvailable": true,
    "scope": "Retained baseline events were audited; cached event completeness is unknown. Public metadata qualifies the baseline ruleset; exact realm subtype is not inferred. No native/visual acceptance transfers."
  },
  "verification": "unverified",
  "sources": [
    {
      "id": "addon",
      "url": "https://github.com/BigWigsMods/BigWigs_Classic/blob/2cc8e655144c096c6c0a070ecb0a1dd9157f81ef/MoltenCore/Garr.lua",
      "quality": "Pinned primary addon; use baseline registrations, exclude explicit seasonal branches; bars are advisory"
    },
    {
      "id": "guide",
      "url": "https://www.wowhead.com/classic/guide/garr-molten-core-strategy-wow-classic",
      "quality": "Retrieved Classic baseline guide; expected mechanics, not original-game pixel proof"
    },
    {
      "id": "baseline-scope",
      "url": "https://warcraft.wiki.gg/wiki/Garr",
      "quality": "Retrieved baseline eight-add description and explicit separate SoM Magmakin section"
    },
    {
      "id": "cache",
      "quality": "Live-qualified Vanilla identity; cached completeness unverified",
      "kind": "retained-evidence",
      "availability": "Referenced by the research. Local evidence and assets are omitted from this library."
    }
  ],
  "expectedMechanics": [
    {
      "id": "M01",
      "mechanic": "Antimagic Pulse and Shackles",
      "spellIds": [
        19492,
        19496
      ],
      "clientCandidateSpellIds": [],
      "trigger": "Actual cast, exact removed buffs and slow aura",
      "state": "Beneficial aura loss separate from slow",
      "lifecycle": "Source-specific removals; missing extraSpellID does not remove all buffs",
      "placement": "Actual recipients/anchors; no inferred speed multiplier",
      "animation": "Pulse and slow appearance independent of gameplay state",
      "acceptanceCheck": "vanilla-mc-garr/V-MC-GARR-AURAS",
      "acceptanceCriteria": "V-MC-GARR-AURAS: exact buff removals, no guessed resistance or slow movement",
      "sourceRefs": [
        "addon",
        "guide",
        "baseline-scope"
      ],
      "verification": "unverified",
      "spellIdEvidence": {
        "mappingStatus": "Research-associated identities; occurrence and native behavior remain independently unverified."
      }
    },
    {
      "id": "M02",
      "mechanic": "Eight Firesworn and control",
      "spellIds": [
        15732
      ],
      "clientCandidateSpellIds": [],
      "trigger": "Baseline eight add identities and actual Banish/Immolate events",
      "state": "Independent controlled or living adds",
      "lifecycle": "Banish is not death; no one-use seasonal immunity rule",
      "placement": "Observed add positions, not copied spawn layout",
      "animation": "Actual aura and independent add bodies",
      "acceptanceCheck": "vanilla-mc-garr/V-MC-GARR-ADDS",
      "acceptanceCriteria": "V-MC-GARR-ADDS: preserve eight Firesworn and each control window",
      "sourceRefs": [
        "addon",
        "guide",
        "baseline-scope"
      ],
      "verification": "unverified",
      "spellIdEvidence": {
        "mappingStatus": "Research-associated identities; occurrence and native behavior remain independently unverified."
      }
    },
    {
      "id": "M03",
      "mechanic": "Firesworn death eruption",
      "spellIds": [
        19497
      ],
      "clientCandidateSpellIds": [],
      "trigger": "Actual death and Eruption results",
      "state": "Death blast separate from corpse presence",
      "lifecycle": "Adds may survive boss death; exact post-fight events retained",
      "placement": "Observed dying add and affected recipients; knockback height unknown",
      "animation": "Exact19497 visual, not seasonal Magmakin20527",
      "acceptanceCheck": "vanilla-mc-garr/V-MC-GARR-ERUPT",
      "acceptanceCriteria": "V-MC-GARR-ERUPT: boss death does not despawn surviving adds or suppress later real eruptions",
      "sourceRefs": [
        "addon",
        "guide",
        "baseline-scope"
      ],
      "verification": "unverified",
      "spellIdEvidence": {
        "mappingStatus": "Research-associated identities; occurrence and native behavior remain independently unverified."
      }
    },
    {
      "id": "M04",
      "mechanic": "Death, wipe and continuation",
      "spellIds": [],
      "clientCandidateSpellIds": [],
      "trigger": "Actual life, completion and continuation evidence",
      "state": "Living, defeated, dead, absent and reset remain distinct",
      "lifecycle": "Close only proven encounter-owned state; retain observed target continuations and raw outcome contradictions",
      "placement": "Observed actor-instance anchors; missing Z stays unknown",
      "animation": "Death and despawn are separate; no fixed reset animation",
      "acceptanceCheck": "vanilla-mc-garr/V-MC-GARR-END",
      "acceptanceCriteria": "V-MC-GARR-END: seek across boundaries preserves life/ownership; no lastSeen expiry or kill-to-death shortcut",
      "sourceRefs": [
        "addon",
        "guide",
        "baseline-scope"
      ],
      "verification": "unverified",
      "spellIdEvidence": {
        "mappingStatus": "No associated spell identity established; do not invent one."
      }
    }
  ],
  "clientCandidateSpellIds": [],
  "candidateLimit": "Client candidates are separate from observed usage and do not authorize aliases, schedules or coordinates.",
  "unresolved": [
    "Exact Eruption radius, vertical knockback and slow speed are unverified.",
    "Standalone boss chapter cannot itself certify later add cleanup; the explicit continuation probe covers only retained chapter14.",
    "Cached coverage is unverified; absence is not proof that a mechanic did not occur.",
    "Realm seasonID6 retained without assigning Hardcore/Fresh subtype.",
    "No native/GPU/browser or actual-game visual acceptance. Missing Z is unknown."
  ],
  "researchContext": {
    "npcIds": [
      12057,
      12099
    ],
    "baselineScope": "Baseline has eight Firesworn. Magmakin/charge spawns are explicitly SoM/SoD additions and excluded. Mixed Icy Veins page includes Magmakin, so it is not used to establish a baseline summon contract."
  }
}
